,number,value,datetime_start,datetime_complete,duration,params_deconv_method,params_denoise_after,params_kernel_angle,params_kernel_length,params_method,params_num_iter,params_post_sharpen_amount,params_regularization_lambda,state
0,0,0.676972462107789,2026-05-31 21:57:19.272369,2026-05-31 21:58:11.508523,0 days 00:00:52.236154,,False,95.41341657920454,13,richardson_lucy,8.0,,,COMPLETE
1,1,0.5858867878648828,2026-05-31 21:58:11.508523,2026-05-31 21:59:31.952849,0 days 00:01:20.444326,,True,92.98015019163338,29,richardson_lucy,9.0,,,COMPLETE
2,2,0.2911626302941116,2026-05-31 21:59:31.952849,2026-05-31 21:59:54.935407,0 days 00:00:22.982558,wiener,,135.77933512776804,23,fergus_blind,39.0,,0.07916778234261754,COMPLETE
3,3,0.4614707175717963,2026-05-31 21:59:54.935407,2026-05-31 22:01:57.183044,0 days 00:02:02.247637,richardson_lucy,,68.64331219092858,25,fergus_blind,21.0,,0.00031452782736157817,COMPLETE
4,4,0.7734916471885402,2026-05-31 22:01:57.183044,2026-05-31 22:02:26.735385,0 days 00:00:29.552341,richardson_lucy,,118.08057714270112,5,fergus_blind,25.0,,0.002411975949155003,COMPLETE
5,5,0.00833839911869928,2026-05-31 22:02:26.735385,2026-05-31 22:02:49.335917,0 days 00:00:22.600532,,,75.6839799232888,31,wiener,,0.6669923235910752,5.3566124249880655e-06,COMPLETE
6,6,0.30743788142692813,2026-05-31 22:02:49.335917,2026-05-31 22:08:06.929026,0 days 00:05:17.593109,richardson_lucy,,138.81132048742552,29,fergus_blind,56.0,,0.0005064683780164811,COMPLETE
7,7,0.444489212247913,2026-05-31 22:08:06.929026,2026-05-31 22:09:34.294698,0 days 00:01:27.365672,,False,64.72561525391109,45,richardson_lucy,13.0,,,COMPLETE
8,8,0.26152809873612876,2026-05-31 22:09:34.294698,2026-05-31 22:15:39.836887,0 days 00:06:05.542189,richardson_lucy,,81.6581127716983,59,fergus_blind,60.0,,0.02247942784486525,COMPLETE
9,9,0.009802324758092413,2026-05-31 22:15:39.837465,2026-05-31 22:16:01.076622,0 days 00:00:21.239157,,,68.34400015370109,45,wiener,,0.7755511211119623,4.565246920742121e-06,COMPLETE
10,10,0.3446863956201909,2026-05-31 22:16:01.076622,2026-05-31 22:16:20.753531,0 days 00:00:19.676909,wiener,,7.9587957395158355,7,fergus_blind,77.0,,0.0015729804269614546,COMPLETE
11,11,0.8305726305086845,2026-05-31 22:16:20.753531,2026-05-31 22:16:53.699996,0 days 00:00:32.946465,,False,173.78098932952508,3,richardson_lucy,28.0,,,COMPLETE
12,12,0.8298978399780007,2026-05-31 22:16:53.699996,2026-05-31 22:17:27.716105,0 days 00:00:34.016109,,False,178.63373043849674,3,richardson_lucy,30.0,,,COMPLETE
13,13,0.5804955852866869,2026-05-31 22:17:27.716105,2026-05-31 22:20:29.913442,0 days 00:03:02.197337,,False,173.94696545517908,13,richardson_lucy,33.0,,,COMPLETE
14,14,0.5824211591331495,2026-05-31 22:20:29.913442,2026-05-31 22:21:17.299112,0 days 00:00:47.385670,,False,174.04245864127972,11,richardson_lucy,47.0,,,COMPLETE
15,15,0.827552422489966,2026-05-31 22:21:17.300158,2026-05-31 22:21:49.045963,0 days 00:00:31.745805,,False,151.97817491885954,3,richardson_lucy,28.0,,,COMPLETE
16,16,0.5506900803561539,2026-05-31 22:21:49.045963,2026-05-31 22:26:21.069347,0 days 00:04:32.023384,,True,176.40744868805297,19,richardson_lucy,41.0,,,COMPLETE
17,17,0.692834336820743,2026-05-31 22:26:21.069347,2026-05-31 22:26:54.877265,0 days 00:00:33.807918,,False,153.85972753598003,9,richardson_lucy,21.0,,,COMPLETE
18,18,0.01296280723857442,2026-05-31 22:26:54.877265,2026-05-31 22:27:23.947163,0 days 00:00:29.069898,,,36.8013348562246,19,wiener,,0.01883279905831231,6.829933013431238e-05,COMPLETE
19,19,0.8072051663389306,2026-05-31 22:27:23.948154,2026-05-31 22:28:10.485359,0 days 00:00:46.537205,,False,118.62594121350233,3,richardson_lucy,55.0,,,COMPLETE
20,20,0.5820012773811063,2026-05-31 22:28:10.485359,2026-05-31 22:31:41.798452,0 days 00:03:31.313093,,True,158.92745488894676,17,richardson_lucy,34.0,,,COMPLETE
21,21,0.8290068990517483,2026-05-31 22:31:41.798452,2026-05-31 22:32:17.563944,0 days 00:00:35.765492,,False,154.22404550197365,3,richardson_lucy,28.0,,,COMPLETE
22,22,0.7433524232715346,2026-05-31 22:32:17.563944,2026-05-31 22:32:43.668514,0 days 00:00:26.104570,,False,131.92159952509556,7,richardson_lucy,17.0,,,COMPLETE
23,23,0.8293475378510322,2026-05-31 22:32:43.668514,2026-05-31 22:33:13.733334,0 days 00:00:30.064820,,False,161.45496675622974,3,richardson_lucy,30.0,,,COMPLETE
24,24,0.6541814460589133,2026-05-31 22:33:13.733334,2026-05-31 22:33:47.318558,0 days 00:00:33.585224,,False,163.526130735471,9,richardson_lucy,34.0,,,COMPLETE
25,25,0.008410203635414927,2026-05-31 22:33:47.318558,2026-05-31 22:34:09.385652,0 days 00:00:22.067094,,,179.17959015809464,15,wiener,,0.18798266924604717,1.7354476764520732e-06,COMPLETE
26,26,0.636177863398926,2026-05-31 22:34:09.385652,2026-05-31 22:34:48.169539,0 days 00:00:38.783887,,False,115.73230691646884,7,richardson_lucy,48.0,,,COMPLETE
27,27,0.6517229357198552,2026-05-31 22:34:48.169539,2026-05-31 22:35:15.441694,0 days 00:00:27.272155,,False,143.01935406697103,11,richardson_lucy,17.0,,,COMPLETE
28,28,0.7991147763001243,2026-05-31 22:35:15.442806,2026-05-31 22:36:13.971390,0 days 00:00:58.528584,,True,165.52014088334215,3,richardson_lucy,38.0,,,COMPLETE
29,29,0.4861828304935568,2026-05-31 22:36:13.971390,2026-05-31 22:39:58.282617,0 days 00:03:44.311227,,False,106.15288386013295,13,richardson_lucy,47.0,,,COMPLETE
30,30,0.020277030201069236,2026-05-31 22:39:58.282617,2026-05-31 22:40:21.775706,0 days 00:00:23.493089,,,129.34042084289936,7,wiener,,0.3982356228964632,3.796072221637263e-05,COMPLETE
31,31,0.8269516122074521,2026-05-31 22:40:21.775706,2026-05-31 22:40:53.020797,0 days 00:00:31.245091,,False,148.5035158496567,3,richardson_lucy,28.0,,,COMPLETE
32,32,0.786351754153097,2026-05-31 22:40:53.021312,2026-05-31 22:41:24.555658,0 days 00:00:31.534346,,False,164.8535849437607,5,richardson_lucy,28.0,,,COMPLETE
33,33,0.7949200300051884,2026-05-31 22:41:24.555658,2026-05-31 22:41:52.818824,0 days 00:00:28.263166,,False,179.72444607591706,5,richardson_lucy,24.0,,,COMPLETE
34,34,0.6582017218343104,2026-05-31 22:41:52.818824,2026-05-31 22:42:28.507173,0 days 00:00:35.688349,,False,164.2376239776712,9,richardson_lucy,33.0,,,COMPLETE
35,35,0.8364474894629714,2026-05-31 22:42:28.507173,2026-05-31 22:42:52.019107,0 days 00:00:23.511934,,False,146.53129972052807,3,richardson_lucy,15.0,,,COMPLETE
36,36,0.7507963096398217,2026-05-31 22:42:52.019954,2026-05-31 22:43:12.742856,0 days 00:00:20.722902,,False,144.32416482378932,11,richardson_lucy,5.0,,,COMPLETE
37,37,0.49461399584928756,2026-05-31 22:43:12.742856,2026-05-31 22:44:27.483768,0 days 00:01:14.740912,,False,131.36347285218304,37,richardson_lucy,10.0,,,COMPLETE
38,38,0.2678239188772622,2026-05-31 22:44:27.483768,2026-05-31 22:44:50.753640,0 days 00:00:23.269872,wiener,,98.30581035894346,23,fergus_blind,14.0,,0.01964359022701316,COMPLETE
39,39,0.7990671454262732,2026-05-31 22:44:50.753640,2026-05-31 22:45:34.995276,0 days 00:00:44.241636,,True,166.34992336307778,5,richardson_lucy,21.0,,,COMPLETE
40,40,0.02826420716073717,2026-05-31 22:45:34.995276,2026-05-31 22:45:53.891822,0 days 00:00:18.896546,wiener,,125.16826320134831,65,fergus_blind,41.0,,2.428572595110599e-05,COMPLETE
41,41,0.8280163747207682,2026-05-31 22:45:53.891822,2026-05-31 22:46:21.353890,0 days 00:00:27.462068,,False,154.35570503855223,3,richardson_lucy,30.0,,,COMPLETE
42,42,0.7879286979338871,2026-05-31 22:46:21.353890,2026-05-31 22:46:46.407508,0 days 00:00:25.053618,,False,139.8833767212445,5,richardson_lucy,24.0,,,COMPLETE
43,43,0.7060946221013228,2026-05-31 22:46:46.407853,2026-05-31 22:47:17.204766,0 days 00:00:30.796913,,False,170.73880486859804,7,richardson_lucy,37.0,,,COMPLETE
44,44,0.8344359117998406,2026-05-31 22:47:17.204766,2026-05-31 22:47:38.198679,0 days 00:00:20.993913,,False,50.762365650359925,3,richardson_lucy,17.0,,,COMPLETE
45,45,0.08044498804181703,2026-05-31 22:47:38.198679,2026-05-31 22:47:58.204501,0 days 00:00:20.005822,,,45.39484405165429,27,wiener,,0.9721130832434748,0.005862948833364405,COMPLETE
46,46,0.7073706922502967,2026-05-31 22:47:58.204501,2026-05-31 22:48:21.412182,0 days 00:00:23.207681,,False,54.29771297983409,9,richardson_lucy,15.0,,,COMPLETE
47,47,0.01696326727370904,2026-05-31 22:48:21.412182,2026-05-31 22:48:40.359430,0 days 00:00:18.947248,wiener,,31.684284910866246,51,fergus_blind,20.0,,1.046272792754774e-06,COMPLETE
48,48,0.5397723114649112,2026-05-31 22:48:40.359430,2026-05-31 22:49:48.272598,0 days 00:01:07.913168,,False,5.110674845633781,35,richardson_lucy,11.0,,,COMPLETE
49,49,0.8279412345475188,2026-05-31 22:49:48.272598,2026-05-31 22:50:07.512844,0 days 00:00:19.240246,,False,172.89167952425237,5,richardson_lucy,8.0,,,COMPLETE
