,number,value,datetime_start,datetime_complete,duration,params_deconv_method,params_denoise_after,params_kernel_angle,params_kernel_length,params_method,params_num_iter,params_post_sharpen_amount,params_regularization_lambda,state
0,0,45.987685546875,2026-05-31 22:50:13.133447,2026-05-31 22:54:33.962405,0 days 00:04:20.828958,,False,33.71755458065692,21,richardson_lucy,50.0,,,COMPLETE
1,1,63.5671630859375,2026-05-31 22:54:33.962405,2026-05-31 22:55:31.678296,0 days 00:00:57.715891,,True,129.14147766372335,7,richardson_lucy,74.0,,,COMPLETE
2,2,148.18488525390626,2026-05-31 22:55:31.678296,2026-05-31 22:55:42.505856,0 days 00:00:10.827560,,,134.8818185109686,21,wiener,,0.7688159234271884,1.2024417614002499e-05,COMPLETE
3,3,52.91860107421875,2026-05-31 22:55:42.505856,2026-05-31 22:58:41.589201,0 days 00:02:59.083345,,False,38.8205163323985,29,richardson_lucy,35.0,,,COMPLETE
4,4,47.356318359375,2026-05-31 22:58:41.589201,2026-05-31 22:58:53.303736,0 days 00:00:11.714535,,,173.9353421671887,33,wiener,,0.9811139243359387,0.01789370879228089,COMPLETE
5,5,65.34968963623047,2026-05-31 22:58:53.303736,2026-05-31 22:59:03.913175,0 days 00:00:10.609439,,,57.53462277126693,11,wiener,,0.4550567501640431,0.0030074369049805606,COMPLETE
6,6,48.95781005859375,2026-05-31 22:59:03.913175,2026-05-31 22:59:14.256621,0 days 00:00:10.343446,,,113.11373780426169,21,wiener,,0.25475055794318224,0.09464355402053301,COMPLETE
7,7,149.28929351806642,2026-05-31 22:59:14.256621,2026-05-31 22:59:26.130876,0 days 00:00:11.874255,,,118.27930393061406,11,wiener,,0.7511191897288036,2.1887114320187593e-05,COMPLETE
8,8,108.78702102661133,2026-05-31 22:59:26.130876,2026-05-31 22:59:36.818956,0 days 00:00:10.688080,,,73.61321043908367,43,wiener,,0.6780690005835532,0.00017157866566477756,COMPLETE
9,9,53.0958984375,2026-05-31 22:59:36.818956,2026-05-31 22:59:46.607565,0 days 00:00:09.788609,wiener,,155.58590899823994,65,fergus_blind,20.0,,0.052670752038188086,COMPLETE
10,10,47.15636474609375,2026-05-31 22:59:46.607565,2026-05-31 23:05:50.844744,0 days 00:06:04.237179,,False,2.412012502283389,39,richardson_lucy,64.0,,,COMPLETE
11,11,47.38537841796875,2026-05-31 23:05:50.845221,2026-05-31 23:11:23.996761,0 days 00:05:33.151540,,False,1.5148429078757142,41,richardson_lucy,64.0,,,COMPLETE
12,12,46.9957861328125,2026-05-31 23:11:23.997751,2026-05-31 23:16:10.046414,0 days 00:04:46.048663,,False,0.026739326873412406,37,richardson_lucy,53.0,,,COMPLETE
13,13,50.172216796875,2026-05-31 23:16:10.046414,2026-05-31 23:20:05.283076,0 days 00:03:55.236662,,False,34.09496068639752,27,richardson_lucy,46.0,,,COMPLETE
14,14,57.488486328125,2026-05-31 23:20:05.283076,2026-05-31 23:25:21.803264,0 days 00:05:16.520188,richardson_lucy,,28.248885650851655,51,fergus_blind,48.0,,1.3699756804269966e-06,COMPLETE
15,15,47.9864892578125,2026-05-31 23:25:21.803264,2026-05-31 23:27:31.814722,0 days 00:02:10.011458,,False,86.07401465957055,17,richardson_lucy,31.0,,,COMPLETE
16,16,56.22152099609375,2026-05-31 23:27:31.814722,2026-05-31 23:32:05.438945,0 days 00:04:33.624223,,True,19.734671453937807,35,richardson_lucy,53.0,,,COMPLETE
17,17,12.848349609375,2026-05-31 23:32:05.438945,2026-05-31 23:32:26.424544,0 days 00:00:20.985599,,False,52.946783779568875,3,richardson_lucy,57.0,,,COMPLETE
18,18,17.806923828125,2026-05-31 23:32:26.435596,2026-05-31 23:32:51.385688,0 days 00:00:24.950092,richardson_lucy,,58.043299440518055,5,fergus_blind,64.0,,0.001175876329558964,COMPLETE
19,19,34.479310302734376,2026-05-31 23:32:51.385688,2026-05-31 23:33:23.514023,0 days 00:00:32.128335,richardson_lucy,,55.356144846534036,7,fergus_blind,77.0,,0.0008968127742167937,COMPLETE
20,20,21.79147705078125,2026-05-31 23:33:23.514023,2026-05-31 23:33:47.110769,0 days 00:00:23.596746,richardson_lucy,,94.78544097475786,5,fergus_blind,63.0,,0.00019961945108108918,COMPLETE
21,21,22.57573486328125,2026-05-31 23:33:47.110769,2026-05-31 23:34:11.606991,0 days 00:00:24.496222,richardson_lucy,,98.42156339183575,5,fergus_blind,64.0,,0.00014494345853281938,COMPLETE
22,22,43.65072998046875,2026-05-31 23:34:11.606991,2026-05-31 23:38:41.248493,0 days 00:04:29.641502,richardson_lucy,,65.99806853293157,13,fergus_blind,61.0,,0.0026028861269608216,COMPLETE
23,23,20.8845263671875,2026-05-31 23:38:41.248493,2026-05-31 23:39:15.168578,0 days 00:00:33.920085,richardson_lucy,,85.39475659478228,5,fergus_blind,71.0,,2.8145629729505614e-05,COMPLETE
24,24,132.37471466064454,2026-05-31 23:39:15.168578,2026-05-31 23:39:25.850990,0 days 00:00:10.682412,wiener,,79.79092433099737,15,fergus_blind,71.0,,2.747292989640716e-05,COMPLETE
25,25,40.90776489257812,2026-05-31 23:39:25.850990,2026-05-31 23:40:03.340642,0 days 00:00:37.489652,richardson_lucy,,49.66044830813499,9,fergus_blind,80.0,,2.7197814824863076e-06,COMPLETE
26,26,45.299951171875,2026-05-31 23:40:03.340642,2026-05-31 23:44:39.150947,0 days 00:04:35.810305,richardson_lucy,,103.22370546499059,17,fergus_blind,70.0,,0.001376095292204083,COMPLETE
27,27,49.7053955078125,2026-05-31 23:44:39.150947,2026-05-31 23:44:46.536974,0 days 00:00:07.386027,wiener,,69.10232886597443,47,fergus_blind,57.0,,0.009767507002050426,COMPLETE
28,28,54.6290625,2026-05-31 23:44:46.536974,2026-05-31 23:50:19.960569,0 days 00:05:33.423595,richardson_lucy,,51.768157461193724,57,fergus_blind,69.0,,4.4635849791792275e-05,COMPLETE
29,29,48.441884765625,2026-05-31 23:50:19.960569,2026-05-31 23:53:45.521327,0 days 00:03:25.560758,richardson_lucy,,40.56324600149052,23,fergus_blind,41.0,,0.0005120560656216148,COMPLETE
30,30,153.07805969238282,2026-05-31 23:53:45.521327,2026-05-31 23:53:52.909496,0 days 00:00:07.388169,wiener,,82.23386153025012,5,fergus_blind,57.0,,6.480782719711848e-06,COMPLETE
31,31,21.9031689453125,2026-05-31 23:53:52.909496,2026-05-31 23:54:15.818452,0 days 00:00:22.908956,richardson_lucy,,95.14504435355401,5,fergus_blind,60.0,,7.846488274356752e-05,COMPLETE
32,32,41.93240234375,2026-05-31 23:54:15.818452,2026-05-31 23:54:47.004016,0 days 00:00:31.185564,richardson_lucy,,65.80585668341622,9,fergus_blind,67.0,,0.00032679358638525245,COMPLETE
33,33,49.56221923828125,2026-05-31 23:54:47.004016,2026-05-31 23:55:30.849544,0 days 00:00:43.845528,richardson_lucy,,107.68163789903768,13,fergus_blind,10.0,,0.0001144256207134289,COMPLETE
34,34,58.67224609375,2026-05-31 23:55:30.849544,2026-05-31 23:56:10.988968,0 days 00:00:40.139424,,True,140.16609685444274,3,richardson_lucy,72.0,,,COMPLETE
35,35,50.89151123046875,2026-05-31 23:56:10.988968,2026-06-01 00:00:35.635485,0 days 00:04:24.646517,richardson_lucy,,120.47353029046866,19,fergus_blind,57.0,,0.007074740670543865,COMPLETE
36,36,56.3835888671875,2026-06-01 00:00:35.635485,2026-06-01 00:01:08.200001,0 days 00:00:32.564516,,True,91.37652248680821,3,richardson_lucy,41.0,,,COMPLETE
37,37,46.5593310546875,2026-06-01 00:01:08.200001,2026-06-01 00:05:59.431146,0 days 00:04:51.231145,richardson_lucy,,16.153483709309597,25,fergus_blind,51.0,,0.0005860604630270216,COMPLETE
38,38,151.57854156494142,2026-06-01 00:05:59.431146,2026-06-01 00:06:08.839325,0 days 00:00:09.408179,,,41.96297737510049,7,wiener,,0.08768168114775893,7.221865980632889e-06,COMPLETE
39,39,13.5504833984375,2026-06-01 00:06:08.839325,2026-06-01 00:06:34.768454,0 days 00:00:25.929129,,False,76.55353543232837,3,richardson_lucy,75.0,,,COMPLETE
40,40,42.0506640625,2026-06-01 00:06:34.770421,2026-06-01 00:07:13.518931,0 days 00:00:38.748510,,False,61.5401996089077,9,richardson_lucy,76.0,,,COMPLETE
41,41,13.88672119140625,2026-06-01 00:07:13.518931,2026-06-01 00:07:37.635255,0 days 00:00:24.116324,,False,75.99681578902928,3,richardson_lucy,67.0,,,COMPLETE
42,42,13.43357421875,2026-06-01 00:07:37.635255,2026-06-01 00:08:04.819767,0 days 00:00:27.184512,,False,76.62000873984759,3,richardson_lucy,79.0,,,COMPLETE
43,43,13.6407763671875,2026-06-01 00:08:04.819866,2026-06-01 00:08:30.504540,0 days 00:00:25.684674,,False,70.87617840689244,3,richardson_lucy,75.0,,,COMPLETE
44,44,13.4049169921875,2026-06-01 00:08:30.504540,2026-06-01 00:08:58.048347,0 days 00:00:27.543807,,False,78.02146455693108,3,richardson_lucy,80.0,,,COMPLETE
45,45,38.70193603515625,2026-06-01 00:08:58.048347,2026-06-01 00:09:30.671873,0 days 00:00:32.623526,,False,73.75213237010486,7,richardson_lucy,80.0,,,COMPLETE
46,46,44.34276245117187,2026-06-01 00:09:30.671873,2026-06-01 00:10:17.147339,0 days 00:00:46.475466,,False,71.63896438263198,11,richardson_lucy,76.0,,,COMPLETE
47,47,14.51566650390625,2026-06-01 00:10:17.147339,2026-06-01 00:10:52.367401,0 days 00:00:35.220062,,False,50.63796541431105,3,richardson_lucy,80.0,,,COMPLETE
48,48,47.05740478515625,2026-06-01 00:10:52.367401,2026-06-01 00:17:22.503619,0 days 00:06:30.136218,,False,43.67275851672959,31,richardson_lucy,75.0,,,COMPLETE
49,49,34.7805810546875,2026-06-01 00:17:22.527763,2026-06-01 00:18:06.904506,0 days 00:00:44.376743,,False,28.299998565702055,9,richardson_lucy,74.0,,,COMPLETE
